{"$schema":"http://json-schema.org/draft-07/schema#","title":"LegendsTimeline","type":"object","required":["version","observed","title","lede","yearMin","yearMax","count","years","packagingEras","sourcesNote"],"properties":{"version":{"type":"string"},"observed":{"type":"string"},"title":{"type":"string"},"lede":{"type":"string"},"yearMin":{"type":"integer"},"yearMax":{"type":"integer"},"count":{"type":"integer"},"years":{"type":"array","items":{"type":"object","required":["year","era","headline","summary","milestones","waves","spotlight"],"properties":{"year":{"type":"integer"},"era":{"type":"string","enum":["Toy Biz","Hasbro"]},"headline":{"type":"string"},"summary":{"type":"string"},"packaging":{"type":["string","null"]},"milestones":{"type":"array","items":{"type":"object","required":["text","sources"],"properties":{"text":{"type":"string"},"sources":{"type":"array","items":{"type":"object","required":["label","url"],"properties":{"label":{"type":"string"},"url":{"type":"string"}}}}}}},"waves":{"type":"array","items":{"type":"object","required":["id","series","figureCount","page"],"properties":{"id":{"type":"string"},"series":{"type":"string"},"figureCount":{"type":"integer"},"baf":{"type":["string","null"]},"page":{"type":"string"}}}},"spotlight":{"type":"array","items":{"type":"object","required":["id","name","waveId","waveSeries","why","page"],"properties":{"id":{"type":"string"},"name":{"type":"string"},"waveId":{"type":"string"},"waveSeries":{"type":"string"},"why":{"type":"string"},"page":{"type":"string"}}}}}}},"packagingEras":{"type":"array","items":{"type":"object","required":["name","years","text","sources"],"properties":{"name":{"type":"string"},"years":{"type":"string"},"text":{"type":"string"},"sources":{"type":"array","items":{"type":"object","required":["label","url"],"properties":{"label":{"type":"string"},"url":{"type":"string"}}}}}}},"sourcesNote":{"type":"string"}}}
