{"version":"1.0.0","observed":"2026-10-11","title":"The Legends Timeline","lede":"Twenty-five years of the Marvel Legends line — Toy Biz's clamshell launch in 2002 to the retro-blister era of 2026. Every wave below links into the archive; every historical claim carries its source.","yearMin":2002,"yearMax":2026,"count":25,"years":[{"year":2002,"era":"Toy Biz","headline":"The line launches","summary":"Marvel Legends debuts as a Toy Biz spin-off of the Spider-Man Classics line, aimed at adult collectors with best-in-class sculpt and articulation. Series 1 through 3 plus Walmart exclusives ship in oversized clamshells, each with a 32-page reprint comic book.","packaging":"Oversized clamshell with 32-page reprint comic pack-in.","milestones":[{"sources":[{"label":"Wikipedia — Marvel Legends","url":"https://en.wikipedia.org/wiki/Marvel_Legends"},{"label":"Wikipedia — Spider-Man Classics","url":"https://en.wikipedia.org/wiki/Spider-Man_Classics"}],"text":"The line begins in 2002 as a spin-off of Spider-Man Classics, copying its clamshell packaging and included comic book."},{"sources":[{"label":"Wikipedia — Marvel Legends","url":"https://en.wikipedia.org/wiki/Marvel_Legends"}],"text":"The first wave ships: Iron Man, Captain America, and Hulk, with Toad as the villain."}],"waves":[{"id":"toybiz-2002-series-1","series":"Series 1","figureCount":7,"baf":null,"page":"waves/toybiz-2002-series-1.html"},{"id":"toybiz-2002-series-2","series":"Series 2","figureCount":7,"baf":null,"page":"waves/toybiz-2002-series-2.html"},{"id":"toybiz-2002-series-3","series":"Series 3","figureCount":6,"baf":null,"page":"waves/toybiz-2002-series-3.html"},{"id":"toybiz-2002-walmart-exclusives","series":"Walmart Exclusives","figureCount":2,"baf":null,"page":"waves/toybiz-2002-walmart-exclusives.html"}],"spotlight":[{"id":"toybiz-2002-series-1::Captain America","name":"Captain America","waveId":"toybiz-2002-series-1","waveSeries":"Series 1","why":"Series 1 launch figure — the wave that started the line.","page":"waves/toybiz-2002-series-1.html"}]},{"year":2003,"era":"Toy Biz","headline":"Box sets arrive","summary":"Series 4 and 5 keep the numbered line rolling while Toy Biz experiments with big-ticket multipacks: the X-Men Legends and Urban Legends box sets.","packaging":null,"milestones":[],"waves":[{"id":"toybiz-2003-series-4","series":"Series 4","figureCount":6,"baf":null,"page":"waves/toybiz-2003-series-4.html"},{"id":"toybiz-2003-series-5","series":"Series 5","figureCount":7,"baf":null,"page":"waves/toybiz-2003-series-5.html"},{"id":"toybiz-2003-box-x-men-legends","series":"Box Set - X-Men Legends","figureCount":5,"baf":null,"page":"waves/toybiz-2003-box-x-men-legends.html"},{"id":"toybiz-2003-box-urban-legends","series":"Box Set - Urban Legends","figureCount":4,"baf":null,"page":"waves/toybiz-2003-box-urban-legends.html"}],"spotlight":[]},{"year":2004,"era":"Toy Biz","headline":"The numbered line grows","summary":"Series 6, 7, and 8 deepen the roster, and the box-set program continues with Spider-Man vs. the Sinister 6 and a Fantastic Four set.","packaging":null,"milestones":[],"waves":[{"id":"toybiz-2004-series-6","series":"Series 6","figureCount":9,"baf":null,"page":"waves/toybiz-2004-series-6.html"},{"id":"toybiz-2004-series-7","series":"Series 7","figureCount":10,"baf":null,"page":"waves/toybiz-2004-series-7.html"},{"id":"toybiz-2004-series-8","series":"Series 8","figureCount":11,"baf":null,"page":"waves/toybiz-2004-series-8.html"},{"id":"toybiz-2004-box-sinister-6","series":"Box Set - Spider-Man vs. Sinister 6","figureCount":7,"baf":null,"page":"waves/toybiz-2004-box-sinister-6.html"},{"id":"toybiz-2004-box-fantastic-four","series":"Box Set - Fantastic Four","figureCount":9,"baf":null,"page":"waves/toybiz-2004-box-fantastic-four.html"}],"spotlight":[]},{"year":2005,"era":"Toy Biz","headline":"Build-A-Figure is born","summary":"Series 9 (the Galactus series) packs one piece of a 16-inch Galactus with every figure — the Build-A-Figure is born. The Sentinel and Apocalypse series follow the same playbook, and the Legendary Riders and Fearsome Foes box sets round out the year. Behind the scenes, Marvel terminates the Toy Biz Worldwide license a year early, paying a $13–16M penalty.","packaging":null,"milestones":[{"sources":[{"label":"FigureRealm — Series 9 checklist","url":"https://www.figurerealm.com/actionfigure?mode=3&action=seriesitemlist&id=3293&ssid=17&series=marvellegendstoybiz"},{"label":"Legendsverse — Galactus wave (2005)","url":"https://legendsverse.com/checklist/marvel-legends/waves/toy-biz-galactus-2005-91"},{"label":"FigureList — Galactus BAF","url":"https://figurelist.co/profile/marvel-legends-galactus-baf/"}],"text":"Series 9 introduces the Build-A-Figure: each figure carries a piece of a larger figure, so buying the full assortment assembles a character unavailable on its own — here, a 16-inch Galactus."},{"sources":[{"label":"Chronicle encyclopedia","url":"encyclopedia.html#history"}],"text":"Marvel terminates the Toy Biz Worldwide license a year early, paying a $13–16M penalty."}],"waves":[{"id":"toybiz-2005-series-9-galactus","series":"Series 9 - Galactus","figureCount":9,"baf":"Galactus","page":"waves/toybiz-2005-series-9-galactus.html"},{"id":"toybiz-2005-series-10-sentinel","series":"Series 10 - Sentinel","figureCount":9,"baf":"Sentinel","page":"waves/toybiz-2005-series-10-sentinel.html"},{"id":"toybiz-2005-legendary-riders","series":"Legendary Riders","figureCount":10,"baf":null,"page":"waves/toybiz-2005-legendary-riders.html"},{"id":"toybiz-2005-series-12-apocalypse","series":"Series 12 - Apocalypse","figureCount":11,"baf":"Apocalypse (Classic and Black versions)","page":"waves/toybiz-2005-series-12-apocalypse.html"},{"id":"toybiz-2005-box-fearsome-foes","series":"Box Set - Spider-Man vs. The Fearsome Foes","figureCount":5,"baf":null,"page":"waves/toybiz-2005-box-fearsome-foes.html"}],"spotlight":[{"id":"toybiz-2005-series-9-galactus::Bullseye","name":"Bullseye","waveId":"toybiz-2005-series-9-galactus","waveSeries":"Series 9 - Galactus","why":"A Series 9 carrier — the wave that debuted Build-A-Figure.","page":"waves/toybiz-2005-series-9-galactus.html"}]},{"year":2006,"era":"Toy Biz","headline":"Toy Biz's last stand","summary":"The final Toy Biz year is a blaze of glory: Series 13 (Onslaught), 14 (Mojo), and 15 (M.O.D.O.K.), a Walmart-exclusive Giant-Man, and House of M, Monsters, and Young Avengers box sets. The Face-Off 2-pack program pairs arch-enemies, and the 12-inch Legends Icons line launches with Captain America, Iron Man, Wolverine, Hulk, Venom, Beast, and Spider-Man. Marvel grants Hasbro a 5-year master toy license — $205M in guaranteed royalties with a $100M non-refundable advance — with retail sales to begin January 1, 2007.","packaging":null,"milestones":[{"sources":[{"label":"Legendsverse — Face-Off Captain America & Red Skull (2006)","url":"https://legendsverse.com/checklist/marvel-legends/figures/face-off-captain-america-red-skull-2006-741"},{"label":"FigureRealm — Face-Off Cap vs Red Skull","url":"https://www.figurerealm.com/actionfigure?action=actionfigure&id=10106"}],"text":"Face-Off 2-packs debut: Series 1 pairs Hulk vs. Leader, Captain America vs. Red Skull, and Daredevil vs. Kingpin; Series 2 adds Punisher vs. Jigsaw, Wolverine vs. Sabretooth, and the Iron Man/War Machine vs. Mandarin sets."},{"sources":[{"label":"Wikipedia — Marvel Legends","url":"https://en.wikipedia.org/wiki/Marvel_Legends"},{"label":"ToyWiz — Icons Hulk (Dec 2006)","url":"https://toywiz.com/marvel-legends-icons-12-inch-series-2-hulk-action-figure/"}],"text":"Marvel Legends Icons launches: 12-inch figures with over 30 points of articulation and an 'Evolution of an Icon' comic-sized book per character."},{"sources":[{"label":"Chronicle encyclopedia","url":"encyclopedia.html#history"}],"text":"Marvel grants Hasbro a 5-year master toy license: $205M guaranteed royalties, $100M non-refundable advance. Retail sales begin January 1, 2007."}],"waves":[{"id":"toybiz-2006-giant-man-walmart","series":"Giant-Man (Walmart Exclusive)","figureCount":12,"baf":"Giant-Man","page":"waves/toybiz-2006-giant-man-walmart.html"},{"id":"toybiz-2006-series-13-onslaught","series":"Series 13 - Onslaught","figureCount":9,"baf":"Onslaught","page":"waves/toybiz-2006-series-13-onslaught.html"},{"id":"toybiz-2006-series-14-mojo","series":"Series 14 - Mojo","figureCount":9,"baf":"Mojo","page":"waves/toybiz-2006-series-14-mojo.html"},{"id":"toybiz-2006-series-15-modok","series":"Series 15 - MODOK","figureCount":12,"baf":"MODOK","page":"waves/toybiz-2006-series-15-modok.html"},{"id":"toybiz-2006-box-young-avengers","series":"Box Set - Young Avengers","figureCount":4,"baf":null,"page":"waves/toybiz-2006-box-young-avengers.html"},{"id":"toybiz-2006-box-monsters","series":"Box Set - Monsters","figureCount":4,"baf":null,"page":"waves/toybiz-2006-box-monsters.html"},{"id":"toybiz-2006-box-house-of-m","series":"Box Set - House of M","figureCount":4,"baf":null,"page":"waves/toybiz-2006-box-house-of-m.html"},{"id":"toybiz-2006-face-off-1","series":"Face-Off Series 1","figureCount":12,"baf":null,"page":"waves/toybiz-2006-face-off-1.html"},{"id":"toybiz-2006-face-off-2","series":"Face-Off Series 2","figureCount":11,"baf":null,"page":"waves/toybiz-2006-face-off-2.html"}],"spotlight":[{"id":"toybiz-2006-face-off-1::Captain America","name":"Captain America","waveId":"toybiz-2006-face-off-1","waveSeries":"Face-Off Series 1","why":"Face-Off Series 1 — arch-enemy pairings were 2006's signature program.","page":"waves/toybiz-2006-face-off-1.html"}]},{"year":2007,"era":"Hasbro","headline":"Hasbro takes over","summary":"The Hasbro era begins January 1, 2007. New packaging drops the comic book pack-in and new molds eliminate Toy Biz's signature finger joints — but the Build-A-Figure theme continues with the Annihilus, Blob, Ronan, Brood Queen, and Sandman (Spider-Man 3) waves, plus the first SDCC and store exclusives.","packaging":"Blister card; comic pack-in dropped; finger jo